WKN;ARIVA_NAME;UNTERNEHMENSPROFIL
A1CWVZ;pharos_energy_plc-aktie;Pharos Energy (ehemals SOCO International plc) ist eine Unternehmensgruppe, die in der Öl- und Gasproduktion tätig ist. Über Tochtergesellschaften und Beteiligungen an Offshore- und Onshore-Projekten ist die Gesellschaft in Vietnam und Ägypten aktiv. Die Anlagen werden ständig erweitert um die Fördermengen zu erhöhen. Der Hauptsitz der Pharos Energy plc ist in London, UK. Copyright 2021 facunda financial data GmbH
A0MW97;fair_value_reit_ag-aktie;Die Fair Value REIT AG fokussiert sich als unabhängige Immobiliengesellschaft auf den Einkauf und die Bewirtschaftung hochwertiger Gewerbeimmobilien. Schwerpunkt der Investitionstätigkeit sind vor allem Büro-, Logistik- und Einzelhandelsimmobilien in deutschen Regionalzentren. Als REIT-AG ist die Fair Value von der Körperschaft- und Gewerbesteuer befreit. Besonderheit der Fair Value ist, neben Direktinvestitionen in Immobilien, der Erwerb von Beteiligungen an Immobilienpersonengesellschaften.Im Juli 2015 wurde ein öffentliches Übernahmeangebot der DEMIRE Deutsche Mittelstand Real Estate AG bekannt. Copyright 2021 facunda financial data GmbH
A1MME7;netfonds-aktie;Kein Unternehmensprofil vorhanden.
626538;tribal_group-aktie;Die Tribal Group plc bietet über ihre Tochtergesellschaften bildungsbezogene Systeme, Lösungen und Beratungsdienste im Vereinigten Königreich, in Australien, im asiatisch-pazifischen Raum, in Nordamerika und international an. Das Unternehmen ist in zwei Segmenten tätig: Studenteninformationssysteme (SIS) und Bildungsdienstleistungen (ES). Das SIS-Segment bietet Software sowie Wartungs- und Unterstützungsdienste an und implementiert und konfiguriert Softwarelösungen, Asset Management und Informationsmanagementdienste für seine Kunden. Das Segment ES bietet Inspektions- und Überprüfungsdienste an, die die Bewertung von Bildungsangeboten unterstützen, sowie ein Portfolio von Tools und Diensten zur Leistungsverbesserung, einschließlich Analysefunktionen. Das Unternehmen beliefert Hochschulen, Weiterbildungseinrichtungen, Berufsbildungsinstitute, Colleges, Schulungsanbieter, Arbeitgeber, Schulen sowie Regierungs- und Staatsorgane. Die Tribal Group plc wurde 1999 gegründet und hat ihren Sitz in Bristol, Vereinigtes Königreich.
763793;nebag-aktie;Die nebag ag ist ein börsenkotierter Vermögensverwalter. Die Firma bietet ihre Dienstleistungen institutionellen und privaten Anlegern an. Sie investiert in der Schweiz oder im benachbarten Ausland. nebag ag hat ihren Sitz in Zürich, Schweiz.
A2LQ2D;029_group_se-aktie;Die 029 Group ist eine globale Hospitality- und Lifestyle-Plattform, die Luxus, Technologie und Gemeinschaft miteinander verbindet, um kategoriedefinierende Marken aufzubauen und zu unterstützen, mit dem Ziel das Leben glücklicher zu machen. Copyright 2021 facunda financial data GmbH
657800;khd_humboldt_wedag_international-aktie;Die KHD Humboldt Wedag International AG ist ein deutsches Unternehmen im Bereich des Baustoffhandels. Der Konzern gehört zu den weltweit führenden Anbietern von Ausrüstung und Zubehör jeglicher Art für Zementwerke. Die Kernkompetenzen des technologieorientierten Unternehmens liegen dabei im Bereich der Verfahrenstechniken und der Projektbetreuung. Die KHD Humboldt Wedag International AG bietet für ihre Kunden in der Zementindustrie eine breite Angebotspalette von unterschiedlichen Produkten und Services. Hierbei legt das Unternehmen besonderen Wert auf Effizienz und Umweltfreundlichkeit der angebotenen Produkte in der Brennprozess- sowie der Schleiftechnologie. Der Konzern ist weltweit tätig und bedient die europäischen und amerikanischen Märkte wie auch den russischen, indischen und chinesischen Markt. Das Geschäft des Unternehmens beschränkt sich dabei nicht auf einen bestimmten, festgelegten Kundenkreis. Vielmehr beliefert die KHD sowohl Globalplayer als auch regionale und lokale Kunden. Um die Bedürfnisse seiner Kunden zu deren Zufriedenheit bearbeiten zu können, operiert der Konzern mit verschieden Niederlassungen, die die jeweiligen Märkte betreuen. Copyright 2021 facunda financial data GmbH
A0KFCC;graphisoft_park-aktie;Die Graphisoft Park SE ist eine ungarische Holding die den Graphisoft Park betreibt, einen 18 Hektar großen Businesspark. Auf dem parkähnlichen Gelände befinden sich Bürogebäude und Laborräume. Der Konzern bietet seinen Kunden die Möglichkeit, die gemieteten Räumlichkeiten nach individuellen Vorgaben umzugestalten und berät sie bei der optimalen Nutzung des Raumes. Zudem übernimmt Graphisoftpark als Betreiber der Anlage sämtliche Instandhaltungs- und Wartungsarbeiten und kontrolliert die täglichen Prozesse. Das Serviceangebot umfasst die Überwachung der Sicherheitssysteme, den Betrieb der Außen- und Parkanlagen, die Bereitstellung von Konferenzräumen für größere Veranstaltungen oder Tagungen sowie einen 24-Studen Concierge-Service. Derzeit arbeiten etwa 60 Unternehmen im Graphisoft Park, darunter SAP, Microsoft oder Canon. Copyright 2021 facunda financial data GmbH
A16820;shareholder_value_beteiligungen-aktie;Die Shareholder Value Beteiligungen AG ist ein börsennotierter Vermögensverwalter. Das Unternehmen erbringt seine Dienstleistungen für institutionelle und private Anleger. Sie verwaltet auch verschiedene Fonds. Das Unternehmen investiert in europaweite Small-Cap-Aktienmärkte des deutschsprachigen Raums. Die Shareholder Value Beteiligungen AG wurde 1999 gegründet und hat ihren Sitz in Frankfurt am Main, Deutschland.
A3C7M8;easymotionskin_tec-aktie;Der Zweck der EasyMotionSkin Tec AG ist die Konzeption, Entwicklung sowie der Vertrieb von Systemen zur Elektromyostimulation (EMS), von Systemen zur Förderung der persönlichen Gesundheit, life-style Produkten sowie zur allgemeinen Verbesserung der Lebensqualität. Die EasyMotionSkin Tec AG ist die Muttergesellschaft der global agierenden EasyMotionSkin Gruppe. Als „kleinstes Fitnessstudio der Welt“ bietet EasyMotionSkin Einsteigern und Sportlern ein hochentwickeltes EMS-Trainingssystem. Patentierte Trockenelektroden in einem EMS-Anzug stimulieren mit niederfrequenten elektrischen Impulsen bis zu 90% der Körpermuskulatur und sorgen so für erhöhte Sauerstoffaufnahme, Leistungssteigerung, optimale Trainingseffekte und Regeneration. Basis für dieses markenrechtlich geschützte High-Tech Produkt sind das Know-how eines führenden Herz-Mediziners aus Deutschland sowie anerkannte Studien, die die positiven Effekte nachweislich belegen. EasyMotionSkin ist ein Premiumprodukt, entwickelt und produziert in Deutschland. Der Kernmarkt ist derzeit die DACH-Region. Erste Vertriebskonzepte gibt es in ausgewählten Drittländern. Durch die Nutzung der Digitalisierung und durch die Entwicklung weiterer Produktnovationen spannt EasyMotionSkin Tec AG den Bogen vom innovativen Fitnesssystemhersteller zum zukunftsorientierten Tech-Unternehmen in der internationalen Gesundheits- und Lifestyle-Branche. Copyright 2021 facunda financial data GmbH
553860;dvs_technology-aktie;Die DVS Technology AG beschäftigt sich mit der Herstellung und dem Vertrieb von Werkzeugmaschinen und Schleifmitteln in Deutschland. Das Unternehmen war früher als Diskus Werke AG bekannt und änderte im August 2019 seinen Namen in DVS Technology AG. Die DVS Technology AG wurde 1911 gegründet und hat ihren Sitz in Dietzenbach, Deutschland.
A2AFKR;zueblin_immobilien_holding-aktie;Züblin Immobilien wurde 1912 als Bau- und Entwicklungsgesellschaft gegründet und hat sich im Laufe der Jahre zu einem international ausgerichteten Immobilienunternehmen mit breiter Kompetenz entwickelt. Das seit 2014 erfolgreich restrukturierte Unternehmen ist finanziell stabil und verfügt über ein gut funktionierendes Schweizer Portfolio.
A0M7HE;npc_incorporated-aktie;Die japanische NPC ist ein Hersteller von Photovoltaik-Produktionsanlagen und Vakuum-Verpackungsmaschinen. Das Unternehmen entwickelt, fertigt, vertreibt und installiert Anlagen zur Herstellung von Photovoltaik-Modulen (etwa Solarzellen). NPC liefert sowohl Maschinen für den Bau von Dünnschichtmodulen als auch Ausrüstung zur Produktion von kristallinen Silizium-Modulen aus. Beide Linien gehen an japanische und internationale Abnehmer. Die Sparte für Vakuum-Verpackungsmaschinen stellt vorrangig für den japanischen Nahrungsmittelsektor her. Die industrielle Zielgruppe umfasst auch Kunden in den Bereichen Automobilteile, elektrotechnische und Elektronik-Komponenten sowie im pharmazeutischen Markt. Copyright 2021 facunda financial data GmbH
604611;biofrontera-aktie;Die Biofrontera AG, ein biopharmazeutisches Unternehmen, beschäftigt sich mit der Forschung, Entwicklung und Vermarktung von dermatologischen Produkten. Zu den Produkten gehören Ameluz und BF-RhodoLED Lampe zur Behandlung von leichten und mittelschweren aktinischen Keratosen im Gesicht und auf der Kopfhaut, Feldkanzerisierung und tödlichen Plattenepithelkarzinomen. Das Unternehmen entwickelt außerdem RhodoLED XL für die Behandlung von mehrfach gestreuten Läsionen, Belixos, ein modernes aktives Kosmetikprodukt für gereizte und empfindliche Haut, und Xepi für die Behandlung von antibiotikaresistenten Bakterien. Das Unternehmen bietet seine Produkte hauptsächlich in den Vereinigten Staaten, Europa und Israel an. Das Unternehmen hat ein Kooperations- und Partnerschaftsabkommen mit Maruho Co., Ltd. Die Biofrontera AG wurde 1997 gegründet und hat ihren Hauptsitz in Leverkusen, Deutschland.
A2G8X3;serviceware-aktie;Die Serviceware SE bietet ein Portfolio an Softwarelösungen für die Digitalisierung und Automatisierung von Serviceprozessen in Deutschland, Österreich, der Schweiz und international. Das Unternehmen bietet eine Enterprise Service Management Plattform an, zu der anafee, eine Software für das Finanzmanagement, helpline, eine Servicemanagement-Lösung, Careware, eine Lösung für den Mobil- und Außendienst, SABIO, eine Wissensmanagement-Lösung, und cubus, eine Software für das Corporate Performance Management, gehören. Darüber hinaus bietet das Unternehmen Softwarelizenzen, Software as a Service, Wartung, Beratung und Implementierung, Managed Services sowie IT-Infrastrukturlösungen an. Das Unternehmen wurde 1998 gegründet und hat seinen Hauptsitz in Idstein, Deutschland.
A2PXPB;capital_2b_regional_gb00bl6xz716-aktie;Capital & Regional ist ein britischer REIT für Einzelhandelsimmobilien, der sich auf Einkaufszentren spezialisiert hat, die ihr Einzugsgebiet dominieren und den nicht-diskretionären und wertorientierten Bedürfnissen der lokalen Bevölkerung entsprechen. Capital & Regional hat eine starke Erfolgsbilanz bei der Verwaltung von wertsteigernden Einzelhandels- und Freizeitimmobilien in einem Portfolio von innerstädtischen Einkaufszentren. Capital & Regional ist am Hauptmarkt der Londoner Börse (LSE) notiert und hat eine Zweitnotierung an der Johannesburger Börse (JSE). Capital & Regional besitzt sieben Einkaufszentren in Blackburn, Hemel Hempstead, Ilford, Luton, Maidstone, Walthamstow und Wood Green. Capital & Regional verwaltet diese Vermögenswerte über seine hauseigene Expertenplattform für Immobilien- und Vermögensverwaltung.
A2QKU6;cig_pannonia_life_insurance-aktie;CIG Pannonia Life Insurance Plc. ist ein im Finanzsektor tätiges ungarisches Unternehmen mit Fokus auf Finanz- und Versicherungsdienstleistungen in mittel- und osteuropäischen Ländern. Die Versicherungsgesellschaft bietet ihren Kunden maßgeschneiderte Produkte und Lösungen und unterstützt Familien und Einzelpersonen rund um das Thema finanzielle Sicherheit. Copyright 2021 facunda financial data GmbH
A1MMEV;sgt_german_private_equity_gmbh_co_kgaa-aktie;SGT German Private Equity ist ein in Deutschland beheimateter, börsennotierter Private Equity-Asset Manager mit Sitz in Frankfurt am Main. Ihre 100%ige Tochtergesellschaft SGT Capital Pte. Ltd., ein globaler Alternative Investment- und Private Equity-Asset Manager mit Hauptsitz in Singapur, erzielt nachhaltig planbare Management Fee-Erlöse von branchenüblich rund 2% des über ihn investierten Eigenkapitals per annum. Die Kapitalzusagen sind dabei langfristig vereinbart und die Erlöse nur von dem zugesagten Fondsvolumen abhängig. Das fünfköpfige Management-Team der 2019 gegründeten SGT Capital hat für ein Vorläufer-Private Equity-Unternehmen ab 2015 innerhalb von zwei Jahren 1,0 Mrd. USD investiert und damit für ihre Fondsinvestoren mit Private Equity-Investments in Europa und den USA bis Anfang 2020 eine Rückzahlung in Höhe von 2,2x des eingesetzten Kapitals geliefert. Für ihren neuen, branchenagnostischen Private Equity-Fonds „SGT Capital Fund II“ mit geografischem Fokus auf Europa und Nordamerika und Laufzeit von zehn Jahren, strebt SGT ein Fundraising-Zielvolumen von 1 bis 3 Mrd. USD an. Das Management Team verfügt über langjährige Führungserfahrungen bei namhaften Adressen – globalen Private Equity-Häusern, Managementberatungen und Investmentbanken. Aus ihrer Historie als ein führender deutscher Venture Capital-Anbieter unter der Marke German Startups Group hält die SGT German Private Equity des Weiteren ein Portfolio an Minderheitsbeteiligungen an teils aussichtsreichen deutschen Startups, über ihre 100%ige Tochter German Startups Group VC GmbH. Copyright 2021 facunda financial data GmbH
A14XB9;steinhoff_international_holdings-aktie;Steinhoff International Holdings N.V. ist eine internationale Holdinggesellschaft mit Beteiligungen im Einzelhandel. Zu den Einzelhandelsgeschäften gehören u.a. Pepco Group, Pepkor Holdings, Greenlit Brands und MattressFirm. Pepco Group ist ein europaweit tätiger Discounter und verkauft Spielzeug, Kleidung, Accessoires, Küchenutensilien und andere Produkte. Pepkor ist ein Einzelhändler mit mehr als 5400 Geschäften in 10 Ländern des südlichen Afrika. Greenlit Brands ist ein Einzelhändler und Hersteller von Haushaltswaren. Mattress Firm ist ein Fachhändler für Bettwaren. Das Unternehmen ist an den Börsen in Frankfurt und Johannesburg notiert. Copyright 2021 facunda financial data GmbH
A0MSH6;addex_pharma-aktie;Addex Therapeutics Ltd, ein biopharmazeutisches Unternehmen im Entwicklungsstadium, erforscht, entwickelt und vermarktet niedermolekulare pharmazeutische Produkte für Erkrankungen des zentralen Nervensystems (ZNS) in der Schweiz. Das Unternehmen konzentriert sich auf die Entdeckung von oralen niedermolekularen allosterischen Modulatoren von G-Protein-gekoppelten Rezeptoren. Zu den führenden Programmen gehören Dipraglurant zur Behandlung von Levodopa-induzierter Dyskinesie und Dystonie bei der Parkinson-Krankheit, ADX71149 zur Behandlung von Epilepsie und nicht genannten ZNS-Erkrankungen sowie GABAB PAM zur Behandlung von Suchtkrankheiten. Das Unternehmen hat Lizenz- und Kooperationsvereinbarungen mit Janssen Pharmaceuticals Inc., Indivior PLC und der Charcot Marie Tooth Association. Das Unternehmen war früher als Addex Pharmaceuticals Ltd bekannt und änderte im März 2012 seinen Namen in Addex Therapeutics Ltd. Addex Therapeutics Ltd wurde im Jahr 2002 gegründet und hat seinen Hauptsitz in Genf, Schweiz.
890218;airesis-aktie;Airesis SA ist eine Private-Equity- und Risikokapitalgesellschaft, die sich auf Early-, Mid- und Late-Venture-, Emerging Growth-, Growth-Capital-, Turnaround-, Buyout- und Pre-IPO-Transaktionen spezialisiert hat. Das Unternehmen investiert in kleine und mittelgroße Unternehmen. Sie investiert vorzugsweise in Sportmarken. Das Unternehmen tätigt auch Investitionen in den Bereichen Immobilien und Marken. Bei Investitionen in der Entwicklungsabteilung strebt das Unternehmen einen Sitz im Vorstand seiner Portfoliounternehmen an. In der Regel investiert es 3 Mio. USD und hält seine Investitionen für drei bis sieben Jahre in seinen Portfoliounternehmen. In der Finanzabteilung erwägt das Unternehmen, bis zu 0,7 Mio. USD in etwa 15 bis 20 Unternehmen pro Jahr zu investieren, wobei ein Ausstieg zwischen einem und zwei Jahren vorgesehen ist. Das Unternehmen zieht es vor, Mehrheitsaktionär zu sein und eine Mehrheitsbeteiligung an seinen Portfoliounternehmen zu übernehmen. Es tätigt bilanzwirksame Investitionen. Das Unternehmen war zuvor unter dem Namen HPI Holding SA bekannt. Airesis SA wurde 2004 gegründet und hat seinen Sitz in Clarens, Schweiz, sowie ein weiteres Büro in Nyon, Schweiz.
A0LGDU;hansard_global-aktie;Hansard Global plc ist ein auf langfristige Spareinlagen spezialisierter Anbieter, der Spar- und Anlageprodukte für Investoren, Institutionen und Vermögensverwaltungsgruppen weltweit anbietet. Das Unternehmen bietet fondsgebundene Lebensversicherungen mit regelmäßiger oder einmaliger Prämie und Investmentverträge, Verwaltungsdienstleistungen sowie Marketing- und Entwicklungsdienstleistungen an. Das Unternehmen betreibt auch Hansard OnLine, ein Vertriebs- und Geschäftsverwaltungsinstrument, das von unabhängigen Finanzberatern (IFAs) und Kunden genutzt wird. Es vertreibt seine Produkte sowohl über IFAs als auch über das Privatkundengeschäft von Finanzinstituten. Das Unternehmen wurde 1970 gegründet und hat seinen Hauptsitz in Douglas (Vereinigtes Königreich).
A0ET25;takarek_mtg_bk_na_a-aktie;Takarek Mortgage Bank Co. Plc ist eine ungarische Bankengruppe, die sich auf Hypothekenvergabe und Immobilienfinanzierung spezialisiert hat. In geringerem Umfang bietet das Kreditinstitut auch kommerzielle Bankprodukte an. Zur Gruppe gehören die FHB Commercial Bank Ltd. (bietet kommerzielle Bankprodukte), FHB Life Annuity Ltd. (wendet sich mit Altersvorsorgeprodukten überwiegend an Senioren), FHB Real Estate Ltd. und FHB Real Estate Leasing Ltd. (beide decken den Immobilienbereich des Kreditinstituts ab). Im Jahr 2011 fusionierte die Allianz Hungaria Insurance Co. Ltd. mit dem ungarischen Kreditinstitut und ging in der FHB Bankengruppe auf. Hauptsitz der Gruppe ist Budapest. Copyright 2021 facunda financial data GmbH
547930;varengold_bank-aktie;Die Varengold Bank AG bietet in Deutschland, dem Vereinigten Königreich und Bulgarien verschiedene Produkte und Dienstleistungen im Bereich Markt- und Transaktionsgeschäft sowie im Commercial Banking an. Das Unternehmen bietet Tages- und Festgeldeinlagen, Kreditvergabe und Fronting Services, internationalen Zahlungsverkehr, Handels- und Exportfinanzierung, Lombardkredite und strukturierte Finanzierungen, Bankgarantien sowie Fremd- und Eigenkapitalmarktprodukte. Sie bedient private und gewerbliche Kunden. Das Unternehmen war früher als Varengold Wertpapierhandelsbank AG bekannt und änderte 2013 seinen Namen in Varengold Bank AG. Die Varengold Bank AG wurde 1995 gegründet und hat ihren Hauptsitz in Hamburg, Deutschland.
A1X3YY;bastei_luebbe-aktie;"Die Bastei Lübbe AG ist ein Medienunternehmen, das in Deutschland, Österreich, Luxemburg und der Schweiz Bücher, Hörbücher, E-Books und andere digitale Produkte in den Genres Belletristik und populärwissenschaftliche Inhalte veröffentlicht. Das Unternehmen ist in den Segmenten ""Bücher"" und ""Romanhefte"" tätig. Das Segment Bücher bietet eine Reihe von Printprodukten unter den Labels Lübbe, Lübbe Life, Quadriga, Eichborn, Baumhaus, Boje, ONE, LYX, LYX.audio, be-books und Lübbe Audio an. Das Segment Romanhefte bietet Romanhefte unter den Namen Der Bergdoktor, Jerry Cotton, Geisterjäger John Sinclair und the westerns an. Das Unternehmen ist auch in der Lizenzierung seiner Rechte tätig. Die Bastei Lübbe AG wurde 1953 gegründet und hat ihren Sitz in Köln, Deutschland."
A3CMGN;hgears_ag-aktie;Die hGears AG entwickelt, fertigt und liefert weltweit Präzisionskomponenten und Subsysteme sowie Systemlösungen. Das Unternehmen bietet Zahnräder, Kettenräder, Wellen, Strukturbauteile, komplette Getriebe und andere funktionskritische Komponenten an. Seine Produkte werden in E-Bikes, Elektro- und Hybridfahrzeugen sowie in Elektro- und Gartengeräten eingesetzt. Das Unternehmen wurde 1958 gegründet und hat seinen Hauptsitz in Schramberg, Deutschland.
884304;bed_bath_beyond-aktie;Bed Bath & Beyond Inc. betreibt zusammen mit ihren Tochtergesellschaften eine Kette von Einzelhandelsgeschäften. Das Unternehmen verkauft eine Reihe von Haushaltswaren, darunter Bettwäsche und verwandte Artikel, Badartikel und Küchentextilien, sowie Heimtextilien, wie Küchen- und Tischartikel, edle Tischartikel, grundlegende Haushaltswaren, allgemeine Heimtextilien, Verbrauchsartikel und verschiedene Jugendprodukte. Das Unternehmen betreibt Geschäfte unter dem Namen Bed Bath & Beyond, buybuy BABY, Harmon, Harmon Face Values oder Face Values. Außerdem bietet es Produkte über verschiedene Websites und Anwendungen an, darunter bedbathandbeyond.com, bedbathandbeyond.ca, harmondiscount.com, facevalues.com, buybuybaby.com, buybuybaby.ca und decorist.com. Darüber hinaus betreibt das Unternehmen Decorist, eine Online-Plattform für Inneneinrichtung, die personalisierte Dienstleistungen für die Gestaltung von Wohnungen anbietet. Bed Bath & Beyond Inc. wurde 1971 gegründet und hat seinen Hauptsitz in Union, New Jersey.
FPH900;francotyp_postalia-aktie;"Die Francotyp-Postalia Holding AG ist Anbieter von Geschäftspost und digitalen Lösungen für Unternehmen und Behörden im In- und Ausland. Das Unternehmen entwickelt, fertigt, vermietet und vertreibt Frankiersysteme. Darüber hinaus vertreibt sie Verbrauchsmaterialien wie Bänder oder Tintenpatronen und bietet Softwarelösungen für das Kostenstellenmanagement sowie Teleportodienstleistungen an. Darüber hinaus sammelt das Unternehmen Post ein, sortiert sie nach Postleitzahlen und liefert sie in Chargen an eine regionale Niederlassung der Deutschen Post oder einen alternativen Postverteiler. Darüber hinaus bietet es Hybridpostdienste und Lösungen für die digitale Kommunikation, Lösungen für die Posteingangsverarbeitung und digitale Kommunikationsdienste mit Produkten wie Signatursoftware, FP Sign, einer cloudbasierten elektronischen Lösung für die rechtsverbindliche digitale Unterzeichnung und den Austausch von Verträgen und Dokumenten, sowie TransACTmail, einem Online-Briefdienst; Vision 360, eine Software, die Frankiermaschinenkunden eine 360-Grad-Sicht auf ihre Portokosten ermöglicht, De-Mail, die Behörden den elektronischen Austausch von Dokumenten ermöglicht, FP Parcel Shipping, das Kunden die Auswahl des Versanddienstleisters für ihre Pakete ermöglicht, Neomonitor, Backoffice- und Frontoffice-Automatisierungslösungen sowie Internet-of-Things-Lösungen. Die Francotyp-Postalia Holding AG wurde 1923 gegründet und hat ihren Hauptsitz in Berlin, Deutschland."
A0LR4P;hwa-aktie;Die HWA AG entwickelt, konstruiert und produziert Technik für Rennsport- und Personenkraftwagen in Deutschland, Australien und den Vereinigten Staaten. Das Unternehmen ist in zwei Segmenten tätig: Motorsport und Fahrzeuge/Fahrzeugkomponenten. Das Unternehmen nimmt unter dem Namen HWA RACELAB an der FIA Formel-2-Meisterschaft und der FIA Formel-3-Meisterschaft teil und ist in der ABB FIA Formel-E-Meisterschaft als Rennteam für das Mercedes-Benz EQ Formel-E-Team vertreten. Das Unternehmen produziert außerdem Sportwagen mit Straßenzulassung in limitierter Auflage sowie die Fahrzeuge Mercedes-AMG GT4 und Mercedes-AMG GT3 MY. Darüber hinaus bietet es Fahrzeugkomponenten, Ersatzteile, mechanische Montage, Modellbau, Logistik, Kundendienst und andere Dienstleistungen für die Automobilindustrie an. Das Unternehmen wurde 1998 gegründet und hat seinen Hauptsitz in Affalterbach, Deutschland.
A2QH97;lion_e_mobility-aktie;Die LION E-Mobility AG ist eine im Jahr 2011 gegründete, börsennotierte Schweizer Holding mit strategischen Investments im E-Mobility Sektor, insbesondere im Bereich elektrische Energiespeicher und Lithium-Ionen-Batteriesystemtechnik. Das Unternehmen besitzt 100% der deutschen LION Smart GmbH, einem Entwickler von Batteriepacks und Batterie-Management-Systemen. Die LION Smart GmbH hält zudem einen 30% Anteil an der TÜV SÜD Battery Testing GmbH, einem erfolgreichen Joint Venture mit der TÜV SÜD AG. Die LION E-Mobility AG ist außerdem 100%ige Eigentümerin der LION E-Mobility North America Inc. Copyright 2021 facunda financial data GmbH
783057;daldrup_soehne-aktie;Die Daldrup & Söhne Aktiengesellschaft erbringt zusammen mit ihren Tochtergesellschaften Bohr- und Umweltdienstleistungen in Deutschland und Mitteleuropa. Das Unternehmen erbringt Bohrdienstleistungen für oberflächennahe Geothermie, wie z.B. Wärmekollektoren und Erdwärmesonden zur Wärme- oder Kältegewinnung, und Bohrdienstleistungen für tiefe Erdwärmesonden zur Wärmegewinnung sowie hydrothermale und petrothermale Systeme zur Stromerzeugung und Wärmegewinnung. Das Unternehmen befasst sich auch mit dem Bohren von Brunnen für die Beschaffung von Trink-, Brauch-, Heil- und Mineralwasser, Kesselspeisewasser, Kühlwasser und Thermalsole. Darüber hinaus bietet es verschiedene Dienstleistungen an, darunter die hydraulische Altlastensanierung, das Bohren von Gasförderbrunnen zur Deponiegasgewinnung, die mobile Umweltanalytik, Grundwassermessstellen und Wasserreinigungsanlagen sowie die Entnahme von Wasserproben. Außerdem erkundet das Unternehmen Vorkommen fossiler Brennstoffe wie Anthrazit, Öl und Gas sowie mineralische Rohstoffe wie Steinsalz, Kupfer, Nickel usw. Darüber hinaus erkundet und sichert es stillgelegte Bergbausysteme und baut Gasförderbrunnen zur Gewinnung von Grubengas. Die Daldrup & Söhne Aktiengesellschaft wurde 1946 gegründet und hat ihren Hauptsitz in Grünwald, Deutschland.
