WKN;ARIVA_NAME;UNTERNEHMENSPROFIL
901876;batm_advanced_communications-aktie;BATM Advanced Communications Ltd. bietet zusammen mit seinen Tochtergesellschaften Echtzeittechnologien für Netzwerklösungen und biomedizinische Systeme in Israel, den Vereinigten Staaten und Europa an. Das Unternehmen ist in den Abteilungen Networking and Cyber und Bio-Medical tätig. Der Geschäftsbereich Networking and Cyber befasst sich mit der Forschung und Entwicklung, Produktion und Vermarktung von Datenkommunikationsprodukten, einschließlich Network Function Virtualization, Carrier-Ethernet- und MPLS-Zugangslösungen sowie Cyber-Netzwerküberwachung. Darüber hinaus bietet sie Software-Dienstleistungen wie Schulungen und technischen Support, Laborservice und -wartung sowie Bauverträge an. Die Sparte Bio-Medical befasst sich mit der Forschung und Entwicklung, der Produktion, dem Marketing und dem Vertrieb von medizinischen Produkten wie Labordiagnostik und Sterilisationsgeräten. Diese Sparte bietet molekularbiologische Diagnostik an, liefert Lösungen für die Behandlung von pathogenen und medizinischen Abfällen in Labors und Krankenhäusern sowie für pharmazeutische Produktionsanlagen und landwirtschaftliche Anwendungen und vertreibt diagnostische Geräte und medizinischen Bedarf verschiedener Marken. BATM Advanced Communications Ltd. arbeitet mit Novamed Ltd. an der gemeinsamen Entwicklung und Vermarktung eines Testkits für COVID-19 für den Hausgebrauch. Das Unternehmen wurde 1992 gegründet und hat seinen Hauptsitz in Hod Hasharon, Israel.
606110;hms_bergbau-aktie;Die HMS Bergbau AG ist zusammen mit ihren Tochtergesellschaften im Handel und Vertrieb von Kohle und anderen Energierohstoffen an Stromerzeuger, Zementhersteller und industrielle Verbraucher weltweit tätig. Das Unternehmen bietet Energierohstoffe wie Kesselkohle, Kokskohle, Anthrazit, PCI-Kohle, Thermalkohle, Petrolkoks und ausgewählte Öl- und Gasprodukte, Metalle und Mineralien wie Eisenerze, Manganerze, Kupfer, Niob, Tantal, Beryllium und Lithium sowie erneuerbare und ergänzende Produkte wie Holzpellets, Biomasse, Wasserstoff, Beryllium, Manganerz, Chromerz, Klinker, Phosphate, Zementprodukte und Düngemittel an. Darüber hinaus bietet das Unternehmen Hafenmanagement, Befrachtung, operative Abwicklung, technische Überwachung, Lagermanagement, Aufbereitung, Qualitätsbeurteilung und Verladung sowie Inlandstransporte per Binnenschiff, Lkw und Bahn sowie Just-in-time-Lieferungen an. Das Unternehmen beliefert Kraftwerksunternehmen, Stahl- und Zementproduzenten sowie Industrieunternehmen wie Glashütten, Papierfabriken und Abfallverwertungsanlagen. Die HMS Bergbau AG wurde 1995 gegründet und hat ihren Hauptsitz in Berlin, Deutschland.
A0DK5W;zwack_unicum-aktie;Zwack Unicum, Plc. ist ein ungarisches Traditionsunternehmen, das sich auf die Herstellung verschiedener hochprozentiger alkoholischer Getränke spezialisiert hat. Eines der bekanntesten Produkte des Konzerns ist der Magenbitter Unicum, dessen Rezeptur bereits 1790 entwickelt wurde. Daneben produziert Zwack heute auch andere Sorten von Bränden, Schnäpsen sowie Likören und vertreibt diese unter den Marken Vilmos, St. Hubertus, Fütyülös, Zwack Pálomkák und Kalinka Vodka. Außerdem werden auch Marken anderer Kooperationspartner über den firmeneigenen Onlineshop verkauft und ausgeliefert. Die Produkte des Konzerns werden außerdem in eigenen Geschäften verkauft oder sind in größeren Kaufhäusern sowie Fachgeschäften erhältlich. Zu den Kunden des Unternehmens gehören neben Privat- auch Geschäftskunden wie Betreiber von Hotels, Restaurants, Bars und Cafés. Copyright 2021 facunda financial data GmbH
549293;masterflex-aktie;Die Masterflex SE entwickelt, produziert und vertreibt zusammen mit ihren Tochtergesellschaften Hightech-Schläuche und Verbindungssysteme für verschiedene Anwendungen in Industrie und Handwerk im In- und Ausland. Das Unternehmen bietet unter der Marke Masterflex Spiral-, Clip-, Folien-, Einschicht-, Mehrschicht-, coextrudierte und mikroextrudierte Schläuche sowie Verbindungselemente, Schellen, Verteiler, Tropfkammern und Trennmembranen für die Bereiche Medizintechnik, Life Sciences, Erneuerbare Energien, Luftfahrt, Automotive und E-Mobility sowie unter der Marke Matzen & Spezialschläuche, Faltenbälge und Formteile für die Luft- und Raumfahrt, die Automobilindustrie und den Schienenverkehr. Timm. Hinzu kommen die Extrusion von Rohren und Profilen unter der Marke Novoplast Schlauchtechnik, Spritzgussteile und montierte Kunststoffkomponenten für die Medizintechnik, Kosmetik und Lebensmitteltechnik unter der Marke Fleima-Plastic sowie Schläuche für die Heizungs-, Lüftungs- und Klimatechnik unter der Marke Masterduct. Die Masterflex SE wurde 1987 gegründet und hat ihren Sitz in Gelsenkirchen, Deutschland.
A0M530;audius_se-aktie;Die im Jahr 1991 gegründete audius SE (ehemals: IT Competence Group SE) ist eine IT-Gesellschaft, die in der DACH-Region aktiv ist. Von der Netzwerktechnik bis hin zur konkreten Anwendung bietet die Unternehmensgruppe die passenden Lösungen für öffentliche Auftraggeber, Mittelständler und international agierende Konzerne. Bei der Betreuung von 350.000 IT-Arbeitsplätzen im DACH-Bereich sind die etwa 500 Mitarbeiter an 16 Standorten – davon 13 in Deutschland – fokussiert auf den Einsatz zukunftsorientierter Technologien und Best Practices. Ein weiterer Geschäftsbereich beschäftigt sich mit Netzinfrastrukturen, insbesondere dem Auf- und Ausbau des 5G-Netzes. Zu den Kunden der Gruppe zählen global agierende Konzerne sowie mittelständische Betriebe. Strategisches Ziel ist es sowohl organisch als auch durch Zukäufe zu wachsen. Die Aktien der audius SE notieren im Basic Board der Börse Frankfurt sowie im Mittelstandssegment m:access der Börse München. Copyright 2021 facunda financial data GmbH
855288;renold_plc_ls_05-aktie;Renold plc fertigt und vertreibt hochpräzise technische Antriebsprodukte im Vereinigten Königreich, im übrigen Europa, in den Vereinigten Staaten, in Australasien, China, Indien und international. Das Unternehmen ist in zwei Segmenten tätig: Ketten und Drehmomentübertragung. Das Unternehmen bietet Standard-, geschweißte Stahl- und Ziehbank-Förderketten sowie Förder- und Dreizackketten für Vergnügungsparks, Becherwerks-, Rolltreppen-, Schwerlastschlepp- und Abwasserbehandlungsketten sowie Standardanbauteile und Siebketten an. Das Unternehmen bietet außerdem flexible Kupplungen, Klauen-, Standard-, Bolzen- und Buchsenkupplungen, Kupplungen für Schiffsantriebe, Generatorsätze und Ajax-Kupplungen, Freilaufkupplungen für Überhol-, Schalt- und Rücklaufanwendungen sowie Schneckengetriebe, Kegelrad- und Stirnradgetriebe, Antriebslösungen für Rolltreppen, kundenspezifische Getriebelösungen, die Aufarbeitung von Fuhrwerken und Ölüberwachungssysteme. Darüber hinaus bietet das Unternehmen Flyerketten für Materialtransportanwendungen, Verarbeitungsgeräte und Vibrationsantriebe wie Rüttler, QE-Vibratoren, elektrische Rotationsvibratoren, Vibrationsabfüllstationen, Vibrationsförderer, Vibrationszuführungen und Schüttgutentlader sowie Kettenzubehör wie Kettenräder, Kettenverschleißführungen, Kettenbolzenabzieher und Kettenspanner. Darüber hinaus bietet das Unternehmen Übertragungsketten an, darunter allgemeine Übertragungsketten, wartungsarme, abriebfeste, korrosionsbeständige Ketten, Ketten mit Standardbefestigung und Polymerblockketten. Das Unternehmen beliefert über Erstausrüster und Händler Kunden in den Bereichen Transport, Bergbau und Steinbrüche, Materialtransport, Industrieprodukte, Umwelt, Lebensmittel und Getränke, Energie, Baumaschinen sowie Land-, Forst- und Fischereiwirtschaft. Das Unternehmen wurde 1864 gegründet und hat seinen Hauptsitz in Manchester, Vereinigtes Königreich.
A2G9M1;capsensixx-aktie;Die capsensixx AG ist im Bereich der Finanzverwaltung als Dienstleistung tätig. Sie bietet Fondsmanagement-, Verwaltungs- und Buchhaltungsdienstleistungen, Unternehmens- und Kapitalmarktdienstleistungen, die Beratungsdienstleistungen in den Bereichen Finanz-Engineering und Verbriefung umfassen, sowie Direktor- und Managementdienstleistungen für Firmenkunden. Das Unternehmen wurde 2017 gegründet und hat seinen Sitz in Frankfurt am Main, Deutschland.
510480;syzygy-aktie;Die SYZYGY AG erbringt über ihre Tochtergesellschaften Media-Content-Dienstleistungen für digitales Marketing in Deutschland, Großbritannien und international. Das Unternehmen bietet ein integriertes Lösungsportfolio, das strategische Beratung, Projektplanung, Konzeption, Design und technische Umsetzung von Markenplattformen, Business-Applikationen, Websites, Hosting, Online-Kampagnen und Mobile Apps umfasst. Hinzu kommen Marketingdienstleistungen wie Datenanalyse, Suchmaschinenmarketing/-optimierung oder Affiliate-Programme sowie Banner und Video-Ads. Digitale Illustrationen, Virtual Reality, Augmented Reality und Animationen runden das Angebot ab. Das Unternehmen bedient die Branchen Automobil, Telekommunikation/IT, Konsumgüter und Finanz-/Versicherungsdienstleistungen. Das Unternehmen wurde 1995 gegründet und hat seinen Sitz in Bad Homburg vor der Höhe, Deutschland. Die SYZYGY AG ist eine Tochtergesellschaft der WPP plc.
633600;lewag_holding-aktie;Die LEWAG Holding AG ist eine in der glasverarbeitenden Industrie tätige Dachgesellschaft mehrerer mittelständischer Unternehmen für Maschinen und Anlagen. Die Gesellschaft besteht ausschließlich aus dem Geschäftsfeld Maschinenbau für die Glas- und Fensterindustrie. Zum Konzern gehört die hundertprozentige Beteiligung an der HEGLA GmbH & Co. KG, die zu den international führenden Produzenten von Maschinen und Systemanlagen, Lager- und Logistiksystemen und Fahrzeugaufbauten für die Flachglas herstellende und verarbeitende Industrie zählt. Zur HEGLA-Gruppe gehören fünf inländische Unternehmen, drei Vertriebs- und Servicegesellschaften in Frankreich, Großbritannien und USA sowie ein Vertriebsbüro in Russland. Des Weiteren hält LEWAG Holding eine minderheitliche Beteiligung an der INTERPANE Glas Industrie AG, die als Glasveredelungs- und Glasverarbeitungsunternehmen in Europa tätig ist. Interpane hält eigene Produktionsniederlassungen zur Herstellung von Floatglas über dessen Veredelung mit modernen Wärmeschutz- oder Sonnenschutzschichten bis zur Produktion von hochwertigem Isolier- und Sicherheitsglast. Copyright 2021 facunda financial data GmbH
A2E4MK;noratis-aktie;Die Noratis AG investiert in Wohnimmobilienportfolios in Deutschland, entwickelt, verwaltet und vertreibt diese. Der Schwerpunkt des Unternehmens liegt auf einem Portfolio von Wohnungen, Wohnanlagen und Wohnsiedlungen. Die Noratis AG wurde im Jahr 2002 gegründet und hat ihren Sitz in Eschborn, Deutschland.
520160;berentzen_gruppe_st-aktie;Die Berentzen-Gruppe Aktiengesellschaft produziert und vertreibt Spirituosen und alkoholfreie Getränke für den Lebensmitteleinzelhandel und das Gastgewerbe in Deutschland, dem übrigen Europa und international. Sie ist in drei Segmenten tätig: Spirituosen, alkoholfreie Getränke und Frischsaftsysteme. Das Unternehmen bietet alkoholfreie Getränke, darunter Mineralwasser, Limonaden, Cola, Mate- und Energy-Drinks, Spirituosen, Fruchtpressen und Entsafter sowie Abfüllanlagen und Orangen. Das Unternehmen vermarktet, vertreibt und verkauft seine Produkte unter den Marken Berentzen, Puschkin, Tres Países, Strothmann Original, Doornkaat, Bommerlunder Aquavit, Echt Stonsdorfer, Hansen Rum, Springer Urvater, POLAR, Dirty Harry, Pabst & Richarz, Cider, MIO MIO, Kräuterbraut, Emsland Quelle, Emsland Sonne, Märkisch Kristall, Vivaris Sport, Sankt Ansgari, Quixx Energy, Sinalco, Citrocasa, Frutas Naturales, und andere Marken. Darüber hinaus bietet das Unternehmen Spirituosen für Markenhändler und Eigenmarken an. Das Unternehmen wurde 1758 gegründet und hat seinen Hauptsitz in Haselünne, Deutschland.
696800;progress_werk_oberkirch-aktie;Die Progress-Werk Oberkirch AG beschäftigt sich mit der Entwicklung und Produktion von Metallkomponenten und Subsystemen für die Mobilitätsindustrie in Deutschland, Tschechien, Kanada, Mexiko, Hog Kong und China. Das Unternehmen bietet mechanische Komponenten für elektrische und elektronische Anwendungen, wie Motorgehäuse, Rotorgehäuse und Abdeckungen für elektronische Steuergeräte. Darüber hinaus bietet das Unternehmen Sicherheitskomponenten für Airbags und Sitze sowie Gehäuse für Lenkradaufhängungen und Strukturkomponenten und Subsysteme für Karosserie und Fahrwerk, bestehend aus Karosserieteilen, Instrumententafelträgern und Luftfedertöpfen. Die Progress-Werk Oberkirch AG wurde 1919 gegründet und hat ihren Hauptsitz in Oberkirch, Deutschland.
576790;fernheizwerk_neukoelln-aktie;Die Fernheizwerk Neukölln AG ist der lokale Wärmeversorger für den Berliner Bezirk Neukölln. Die Geschäftstätigkeit im heutigen zentralen Standort, dem Heizwerk Weigandufer, begann bereits im Jahr 1908. 1988 erfolgte die Umwandlung in eine AG. Das Fernheizwerk Neukölln erzeugt Wärme für insgesamt 40.000 Haushalte sowie Geschäftskunden. Weitere Kernbereiche des Unternehmens sind der Handel mit Rohstoffen, Energien, Wirtschaftsgütern und Dienstleistungen. Ein weiteres Geschäftssegment besteht aus der Vermietung von Gewerbeimmobilien (Büros) am Standort Neukölln. Copyright 2021 facunda financial data GmbH
A1A6WE;doccheck-aktie;Die DocCheck AG bietet Marketing-, Customer Relationship Management- und E-Commerce-Dienstleistungen für den Gesundheitssektor in Europa an. Das Unternehmen betreibt das DocCheck-Portal für den Informationsaustausch im Internet sowie Online- und E-Commerce-Services für Akteure im Gesundheitsmarkt. Darüber hinaus entwickelt und implementiert es Kommunikationsstrategien für Medien im Gesundheitswesen und im Business-to-Business-Sektor und fördert Startups im Gesundheitswesen durch Seed-Finanzierung. Das Unternehmen hat seinen Sitz in Köln, Deutschland.
518160;weng_fine_art-aktie;Kein Unternehmensprofil vorhanden.
A1XEY8;rm_education-aktie;RM plc liefert Produkte, Dienstleistungen und Lösungen für den Bildungsmarkt im Vereinigten Königreich und international. Das Unternehmen ist in drei Abteilungen tätig: RM Resources, RM Assessment und RM Technology. Der Geschäftsbereich RM Resources bietet Lehrmittel und Bildungsbedarf für Schulen und Kindergärten über den Direktvertrieb, das Internet und den Direktkatalog an. Der Geschäftsbereich RM Assessment bietet IT-Software und End-to-End-Digital-Assessment-Services für die Online-Prüfungsbewertung, Online-Tests und die Verwaltung und Analyse von Bildungsdaten. Die Software hilft den Kunden, die Einführung digitaler Verfahren zu beschleunigen und die Bewertung in den Bereichen Praxis, Fortschritt, Nachweiserhebung und Prüfungen zu transformieren, um Vorteile für das Lehren und Lernen zu erzielen. Der Geschäftsbereich RM Technology bietet IT-Dienstleistungen für Schulen und Hochschulen an, um eine Technologieumgebung zu schaffen, die die Lernergebnisse verbessert. Dieser Bereich bietet IT-Outsourcing-Dienstleistungen, Cloud-basierte Produkte und digitale Plattformen an. RM plc wurde 1973 gegründet und hat seinen Hauptsitz in Abingdon, Vereinigtes Königreich.
721890;schwaelbchen_molkerei_jakob_berz-aktie;Schwälbchen Molkerei Jakob Berz AG ist ein Anbieter von verschiedenen Milchprodukten wie beispielsweise Joghurt, saure Sahne, Quark, Creme Fraiche, Milch-Mixgetränke, Kaffeeprodukte der Marke Caffreddo sowie von frischer und haltbarer Milch unter der Marke Schwälbchen. Die Produkte werden überregional vermarktet. Ein Vertriebs- und Marketingschwerpunkt ist die „Grüne Linie“ mit dem Fokus auf Biolebensmitteln und Nachhaltigkeit. Neben der Etablierung der Kaffeemarke Caffreddo ist die Molkerei mit dem Schwälbchen Frischdienst, der unter anderem als Vertriebspartner exklusiver Eissorten wie Langnese und Ben & Jerry’s fungiert, sowie der Nachhaltigkeitsinitiative „Nähe ist gut“ am Markt präsent. Copyright 2021 facunda financial data GmbH
A0MZ4B;delignit-aktie;Die Delignit AG entwickelt, produziert und vertreibt mit ihren Tochtergesellschaften ökologische und laubholzbasierte Werkstoffe und Systemlösungen auf Basis des natürlichen, nachwachsenden und CO2-neutralen Rohstoffs Holz in Deutschland. Darüber hinaus produziert und vertreibt das Unternehmen Laderaumschutz- und Sicherheitssysteme für leichte Kraftfahrzeuge an Erstausrüster und Nachrüster in Form von Laderaumböden, -wänden und -trennwänden, Schranksystemen für Wohnmobile sowie Kofferraumabdeckungen für Pkw. Darüber hinaus bietet das Unternehmen Bodenlösungen für Automobilwerke sowie für Warenverteilzentren und Buchenmultiplexsortimente, hoch- und mittelverdichtete Werkstoffe, die im Anlagen-, Maschinen- und Transformatorenbau zum Einsatz kommen, und fertigt Schienenfahrzeuge mit Bodensystemlösungen für Brandschutz- und Schallschutzkonzepte sowie Spezialprodukte für den Modellbau, Musikinstrumente und Sportgeräte. Das Unternehmen bietet seine Produkte und Lösungen unter den Markennamen Delignit, VANYCARE, Carbonwood, Dunacore, Feinholz, Festholz und Panzerholz an. Die Delignit AG wurde im Jahr 1799 gegründet und hat ihren Sitz in Blomberg, Deutschland.
A0KD0F;muehlhan-aktie;Die Muehlhan AG bietet zusammen mit ihren Tochtergesellschaften weltweit Oberflächenschutz und Industriedienstleistungen an. Das Geschäftsfeld Erneuerbare Energien bietet dem Markt für erneuerbare Energien vor allem Oberflächenschutz für Windenergieanlagen und Umspannplattformen in Offshore- und Onshore-Windparks an und übernimmt Installations- und andere Dienstleistungen. Das Segment Schiffe bietet eine Reihe von Instandhaltungs- und Renovierungsdienstleistungen für Oberflächenbeschichtungen an, wie z. B. Reparaturarbeiten an Außenwänden und Isolierungsarbeiten an neuen Schiffen sowie die Sanierung von Wasser-, Ballast-, Kraftstoff- und Ladetanks für Reedereien und Werften. Das Segment Bau/Infrastruktur bietet Beschichtungslösungen für Stahl- und Betonkonstruktionen, Gerüstbaulösungen für den Hoch- und Tiefbau, Brückenneubauten und -sanierungen, Schleusen, Wasserversorgungs- und Verkehrsinfrastrukturprojekte sowie Spezialmaschinen und passiven Brandschutz, der bei großen Stahlkonstruktionen wie Flughäfen, Brücken, Wolkenkratzern und Industriegebäuden eingesetzt wird. Das Segment Oil & Gas bietet Oberflächen- und Brandschutz, Isolierung und Gerüstbau als Partner für Unternehmen der Offshore-Öl- und Gasindustrie sowie der Petrochemie. Darüber hinaus bietet das Unternehmen Dienstleistungen in den Bereichen Steigtechnik, Trainingsprogramme und -kurse, Engineering und Inspektion sowie Stahlbau für Werften und Industrie-/Infrastrukturkunden an. Die Muehlhan AG wurde 1881 gegründet und hat ihren Hauptsitz in Hamburg, Deutschland.
558000;dierig_holding-aktie;Die Dierig Holding AG ist im Textilgeschäft in Deutschland und international tätig. Das Unternehmen bietet Roh- und Fertiggewebe sowie Textilien für Hotels, Krankenhäuser und Pflegeeinrichtungen an. Das Unternehmen produziert auch Bettwäsche unter den Marken Fleuresse und Kaeppel. Darüber hinaus ist das Unternehmen in der Vermietung und Entwicklung von Immobilien tätig. Das Unternehmen wurde 1805 gegründet und hat seinen Sitz in Augsburg, Deutschland. Die Dierig Holding AG ist eine Tochtergesellschaft der Textil-Treuhand GmbH.
A1W9NS;ferratum-aktie;Die Multitude SE bietet zusammen mit ihren Tochtergesellschaften mobiles Banking sowie digitale Verbraucher- und Kleinkredite für Privat- und Geschäftskunden an. Das Kreditportfolio besteht aus Mikrokrediten, PlusLoans, Primeloan und revolvierenden Krediten sowie Betriebsmittel-Ratenkrediten und Einkaufsfinanzierung. Darüber hinaus bietet das Unternehmen Girokonten, Spar- und Termineinlagen, Debitkarten sowie Zahlungen und Überweisungen an. Das Unternehmen ist in Nordeuropa, Westeuropa, Osteuropa und international tätig. Das Unternehmen war früher unter dem Namen Ferratum Oyj bekannt und änderte im Juni 2021 seinen Namen in Multitude SE. Multitude SE wurde im Jahr 2005 gegründet und hat seinen Hauptsitz in Helsinki, Finnland.
A2AAE2;sbf-aktie;Die SBF AG und ihre Beteiligungen sind im Mobilitätssektor, insbesondere der Schienenfahrzeugindustrie tätig. Die SBF AG fungiert hierbei als geschäftsleitende Holdinggesellschaft. Der operative Geschäftsbereich wird durch die Tochtergesellschaft SBF Spezialleuchten GmbH betrieben. Die SBF Spezialleuchten GmbH ist ein internationaler Systemanbieter für Decken-, Beleuchtungs- und Belüftungssysteme für Schienenfahrzeuge. Das Unternehmen hat sich dabei auf LED-Systeme für den Außen- und Innenbereich von Schienenfahrzeugen jeglicher Bauart spezialisiert. Das Leistungsspektrum erstreckt sich von Front- und Trittstufenbeleuchtungen im Exterieur über Lichtbänder in Deckensystemen und Leseleuchten im Interieur. Ein starker Fokus in der Entwicklung liegt auf dem neuen Trend, mittels Applikationen den Kundennutzen deutlich zu erhöhen. Die SBF Spezialleuchten bietet ihren Kunden maßgeschneiderte Lösungen aus einer Hand und deckt dabei die gesamte Wertschöpfungskette von der Konzeption über die Konstruktion bis hin zur Fertigung ab. Copyright 2021 facunda financial data GmbH
577410;fortec_elektronik-aktie;Die FORTEC Elektronik AG ist ein deutscher und internationaler Anbieter von Komponenten und Systemen in den Bereichen Displaytechnik, Embedded Systems und Stromversorgungen. Das Unternehmen ist in zwei Segmenten tätig, Datenvisualisierung und Stromversorgungen. Das Segment Datenvisualisierung bietet Standard-Kits und Support-Services zu Produktlösungen mit Zugang zu selbst entwickelten TFT-Controller- und Ansteuerungslösungen sowie die Generierung von Optical Bonding Technologie. Das Segment Stromversorgungen bietet Stromversorgungen und DC/DC-Wandler an. Die Fortec Elektronik AG wurde 1984 gegründet und hat ihren Sitz in Germering, Deutschland.
677550;nordwest_handel-aktie;Die NORDWEST Handel AG ist ein deutsches Unternehmen, das im Bereich des Produktionsverbindungshandels agiert. Als eines der größten Verbundunternehmen des deutschen Produktionsverbindungshandels (PVH) fungiert der Konzern als Bindeglied zwischen Fachgroßhandel und Industrie für die Branchen Beschläge/Bauelemente, Sanitär/Heizung/Tiefbau, Stahl/Eisenwahren und Werkzeuge/Werkstatt- und Industriebedarf/Arbeitsschutz. Die NORDWEST Handel AG versteht sich selbst als Dienstleister und Back-Office und bietet seinen Mitgliedsunternehmen neben umfassenden Serviceleistungen auch günstige Einkaufskonditionen. Um die Serviceleistungen branchengenau anbieten zu können, kooperiert das Unternehmen mit zahlreichen Fachhandelspartnern in ganz Europa. Die angebotenen Services erstrecken sich über die Bereiche Vertrieb, Vertriebskonzepte, E-Business, Logistik und Finanzen. In Zusammenarbeit mit Tochterfirmen und anderen Beteiligungen ist der Konzern bestrebt, in allen Geschäftsbereichen kundenorientierte Lösungen anzubieten. Hierzu gehört z.B. die e-direct Datenservice GmbH, deren Aufgabe in der Aufbereitung und Bereitstellung von artikelbezogenen Daten liegt. Copyright 2021 facunda financial data GmbH
522877;orbis-aktie;Die Orbis SE ist ein international tätiges Beratungsunternehmen, das auf die Branchen Industrie, Automotive, Konsumgüter und Handel ausgerichtet ist. Die Kernkompetenzen liegen in der Beratung von kundenorientierten Unternehmensprozessen (Costumer Relationship Management - CRM), unternehmensinternen Prozessen (Enterprise Resource Planning - ERP und Product Lifestyle Management - PLM) und von lieferantenorientierten Unternehmensprozessen (Supply Chain Management - SCM). Dabei verfolgt Orbis einen durchgängigen Berateransatz von der strategischen und prozessorientierten Beratung über Technologieberatung und Systemintegration bis hin zur Multimediaberatung. Besondere Branchenkompetenz hat das Unternehmen in der Industrie und im Konsumgütersektor. Copyright 2021 facunda financial data GmbH
A0LBFE;mevis_medical_solutions-aktie;Die MeVis Medical Solutions AG entwickelt, vermarktet und vertreibt Software zur Analyse und Auswertung von Bilddaten an Gerätehersteller von medizinischen Geräten, Anbieter von medizinischen IT-Plattformen und klinische Endkunden in den USA und Europa. Die klinischen Schwerpunkte des Unternehmens liegen in der bildbasierten Früherkennung und Diagnose epidemiologisch bedeutsamer Krankheiten wie Brust-, Lungen-, Leber- und neurologischen Erkrankungen. Es bietet Röntgenmodalitäten wie Computertomographie, digitale Mammographie, digitale Tomosynthese, Magnetresonanztomographie und digitale Sonographie an und erbringt Dienstleistungen im Bereich der Softwareprogrammierung für Medizintechnikunternehmen, die die Bereitstellung von Softwareentwicklern, Produkt- und Projektmanagern, Anwendungsspezialisten und Testingenieuren umfassen. Darüber hinaus bietet das Unternehmen dreidimensionale technische Visualisierungen, interaktive Online-Schulungen zur Verbesserung der diagnostischen Fähigkeiten von Klinikern sowie internetbasierte Spezialanwendungen in der Teleradiologie an. Darüber hinaus werden seine Dienste für die technische Visualisierung und das Online-Training genutzt. Das Unternehmen wurde 1992 gegründet und hat seinen Sitz in Bremen, Deutschland. Die MeVis Medical Solutions AG ist eine Tochtergesellschaft der Varex Imaging Deutschland AG.
